447	Sorry my battery died I can come by but Im only getting a gram for now wheres your place
2595	Tmr timin still da same wat cos i got lesson until 6
3972	Thats the trouble with classes that go well  youre due a dodgey one … Expecting mine tomo See you for recovery same time same place
3755	Ya that one is slow as poo
5030	Go chase after her and run her over while shes crossing the street
4793	Send me your resume
672	Ho ho  big belly laugh See ya tomo
2074	That is wondarfull song
4462	This is wishing you a great day Moji told me about your offer and as always i was speechless You offer so easily to go to great lengths on my behalf and its stunning My exam is next friday After that i will keep in touch more Sorry
2851	YOUR CHANCE TO BE ON A REALITY FANTASY SHOW call now  08707509020 Just 20p per min NTT Ltd PO Box 1327 Croydon CR9 5WB 0870 is a national  rate call
2223	I notice you like looking in the shit mirror youre turning into a right freak
3293	Im not smoking while people use wylie smokes too much to justify ruining my shit
3908	Went fast asleep deartake care
4140	Good No don‘t need any receipts—well done … Yes please tell  What‘s her number i could ring her
827	Hmm  Bits and pieces lol  sighs 
1320	Ok
5257	I didnt get anything da
794	YWHERE U AT DOGBREATH ITS JUST SOUNDING LIKE JAN C THATS AL
1938	My planning usually stops at find hella weed smoke hella weed
15	I HAVE A DATE ON SUNDAY WITH WILL
721	Macha dont feel upseti can assume your mindsetbelieve me one evening with me and i have some wonderful plans for both of usLET LIFE BEGIN AGAINcall me anytime
1111	S sfirst timedhoni rocks
2455	How much she payed Suganya
5295	Urgent Please call 09061213237 from landline £5000 cash or a luxury 4 Canary Islands Holiday await collection TCs SAE PO Box 177 M227XY 150ppm 16
2869	Mum ive sent you many many messages since i got here I just want to know that you are actually getting them Do enjoy the rest of your day
1611	You all ready for  big day tomorrow
4427	Just now saw your messageit k da
4830	Lol no Just trying to make your day a little more interesting
2745	But my family not responding for anything Now am in room not went to home for diwali but no one called me and why not coming It makes me feel like died
2654	No need for the drug anymore
1846	Da is good good playerwhy he is unsold
4246	Aight Im chillin in a friends room so text me when youre on the way
2242	K Ill call you when Im close
2320	On the way to office da
5224	Jane babes not goin 2 wrk feel ill after lst nite Foned in already cover 4 me chuck
1425	Lol great now im getting hungry
3684	Hello hello hi lou sorry it took so long 2 reply I left mobile at friends in Lancaster just got it bak Neway im sorry I couldnt make ur bday 2 hun
5143	Yeah I imagine he would be really gentle Unlike the other docs who treat their patients like turkeys
1373	I though we shd go out n have some fun so bar in town or something – sound ok
3683	LOL what happens in Vegas stays in vegas
3690	Ill meet you in the lobby
1970	2 laptop I noe infra but too slow lar I wan fast one
833	Hi mate its RV did u hav a nice hol just a message 3 say hello coz havent sent u 1 in ages started driving so stay off roadsRVx
5021	Great How is the office today
520	That way transport is less problematic than on sat night By the way if u want to ask  n  to join my bday feel free But need to know definite nos as booking on fri
4924	Hi Dear Call me its urgnt I dont know whats your problem You dont want to work or if you have any other problem at least tell me Wating for your reply
5325	Thanks Ill keep that in mind
2880	Hey Boys Want hot XXX pics sent direct 2 ur phone Txt PORN to 69855 24Hrs free and then just 50p per day To stop text STOPBCM SF WC1N3XX
1242	Oh yes I can speak txt 2 u no Hmm Did u get  email
719	Book which lesson then you msg me I will call up after work or sth Im going to get specs My membership is PX3748
3075	Somebody should go to andros and steal ice
2301	Congrats 1 year special cinema pass for 2 is yours call 09061209465 now C Suprman V Matrix3 StarWars3 etc all 4 FREE bx420ip45we 150pm Dont miss out
782	Your opinion about me 1 Over 2 Jada 3 Kusruthi 4 Lovable 5 Silent 6 Spl character 7 Not matured 8 Stylish 9 Simple Pls reply
5528	I want to tell you how bad I feel that basically the only times I text you lately are when I need drugs
4723	Yup Anything lor if u dun wan its ok
1861	Whats up Do you want me to come online
771	Lol I know Theyre so dramatic Schools already closed for tomorrow Apparently we cant drive in the inch of snow were supposed to get
4220	Actually im waiting for 2 weeks when they start putting ad
2865	Ok that would b lovely if u r sure Think about wot u want to do drinkin dancin eatin cinema in out about Up to u Wot about 
1804	Ok lor thanx Ü in school
3182	There the size of elephant tablets  u shove um up ur ass
2028	Nah man my car is meant to be crammed full of people
4903	Taka lor Wat time u wan 2 come n look 4 us
3360	I dont run away frm u I walk slowly amp it kills me that u dont care enough to stop me
4023	We have to pick rayan macleran there
2256	Ok Me watching tv too
1482	Have you always been saying welp
1908	And stop being an old man You get to build snowman snow angels and snowball fights
4179	Ok lor then we go tog lor
4009	Im reaching home in 5 min
1453	Ya when are ü taking ure practical lessons I start in june
84	You will be in the place of that man
2677	Im sick  Im needy  I want you  pouts stomps feet Where are you  pouts stomps feet I want my slave  I want him now 
1563	Dnt worryuse ice pieces in a cloth packalso take 2 tablets
1573	Near kalainar tv officethenampet
5535	happened here while you were adventuring
1878	Watching tv now I got new job 
1255	Mum say we wan to go then go Then she can shun bian watch da glass exhibition
4811	Dont worry though I understand how important it is that I be put in my place with a poorly thought out punishment in the face of the worst thing that has ever happened to me Brb gonna go kill myself
1555	Ok how you dear Did you call chechi
3225	Well that must be a pain to catch
3242	A cute thought for friendship Its not necessary to share every secret with ur close Frnd but watever u shared should be true
3010	Loan for any purpose £500  £75000 Homeowners  Tenants welcome Have you been previously refused We can still help Call Free 0800 1956669 or text back help
1968	Whats a feathery bowa Is that something guys have that I dont know about
2776	Dude u knw also teluguthts gudk gud nyt
2519	Sorry Ill call later
5571	Will ü b going to esplanade fr home
3967	Love you aathilove u lot
739	Hi Customer Loyalty OfferThe NEW Nokia6650 Mobile from ONLY £10 at TXTAUCTION Txt word START to No 81151  get yours Now 4TCtxt TC 150pMTmsg
461	Going thru a very different feelingwavering decisions and coping up with the same is the same individualtime will heal everything i believe
3669	Honey  Sweetheart  Darling  Sexy buns  Sugar plum  Loverboy  I miss you boytoy  smacks your ass Did you go to the gym too 
80	Its not the same here Still looking for a job How much do Tas earn there
3994	Dizzamn aight Ill ask my suitemates when I get back
5124	Oops I did have it   
2279	Hello How r u Im bored Inever thought id get bored with the tv but I am Tell me something exciting has happened there Anything 
4363	Dont Think About What u Have Got Think About How to Use It That You Have Got gooD ni8
966	Are you this much buzy
5034	Ok i vldo u know i got adsense approved
2523	Sorry Ill call later
5123	PRIVATE Your 2003 Account Statement for 078
1246	Now Im going out 4 dinner soon
2970	Mostly sports typelyk footblcrckt
2151	Waaaat Lololo ok next time then
40	Hello Hows you and how did saturday go I was just texting to see if youd decided to do anything tomo Not that im trying to invite myself or anything
1163	K I will sent it again
1711	U meet other fren dun wan meet me ah Muz b a guy rite
3646	 Thought I didnt see you
3703	Shall i get my pouch
2321	In which place do you want da
892	Why do you ask princess
2953	Hey now am free you can call me
5002	Well its not like you actually called someone a punto That woulda been worse
2126	Beautiful Truth against Gravity Read carefully Our heart feels light when someone is in it But it feels very heavy when someone leaves it GOOD NIGHT
5212	I know you are thinkin malaria But relax children cant handle malaria She would have been worse and its gastroenteritis If she takes enough to replace her loss her temp will reduce And if you give her malaria meds now she will just vomit Its a self limiting illness she has which means in a few days it will completely stop
4945	Check maili have mailed varma and kept copy to you regarding membershiptake careinsha allah
1046	We know someone who you know that fancies you Call 09058097218 to find out who POBox 6 LS15HB 150p
280	Just sent it So what type of food do you like
2651	You might want to pull out more just in case and just plan on not spending it if you can I dont have much confidence in derek and taylors money management
607	TaKe CaRE n gET WeLL sOOn
1559	Wat r u doing
4127	May b approve panalambut it should have more posts
959	Welp apparently he retired
4704	Anytime
1210	Also maaaan are you missing out
324	cud u tell ppl im gona b a bit l8 cos 2 buses hav gon past cos they were full  im still waitin 4 1 Pete x
659	You will be in the place of that man
3402	As a valued customer I am pleased to advise you that following recent review of your Mob No you are awarded with a £1500 Bonus Prize call 09066364589
4712	Ya i knw u vl givits ok thanks kanoanyway enjoy wit ur family wit 1st salary
5150	Get your garden ready for summer with a FREE selection of summer bulbs and seeds worth £3350 only with The Scotsman this Saturday To stop go2 notxtcouk
4746	Thinking of u  x
1109	From someone not to smoke when every time Ive smoked in the last two weeks is because of you calling or texting me that you wanted to smoke
3636	Its a big difference    versus    every   hrs
4733	Keng rocking in ashes
1128	Not tonight mate Catching up on some sleep This is my new number by the way
2540	The monthly amount is not that terrible and you will not pay anything till 6months after finishing school
2316	Also that chat was awesome but dont make it regular unless you can see her in person
4662	You call him and tell now infront of them Call him now
658	Sun cant come to earth but send luv as rays cloud cant come to river but send luv as rain I cant come to meet U but can send my care as msg to U Gud evng
4693	Surly ill give it to you while coming to review
2854	how tall are you princess
1796	How much i gave to you Morning
2453	I know complain num onlybettr directly go to bsnl offc nd apply for it
3653	Want to send me a virtual hug I need one
121	PRIVATE Your 2004 Account Statement for 07742676969 shows 786 unredeemed Bonus Points To claim call 08719180248 Identifier Code 45239 Expires
5329	What makes you most happy
473	How long has it been since you screamed princess
3545	Im e person whos doing e sms survey
4670	IM REALY SOZ IMAT MY MUMS 2NITE WHAT ABOUT 2MORO
4826	Not thought bout it  Drink in tap  spile at seven  Is that pub on gas st off broad st by canal  Ok
3969	YOU HAVE WON As a valued Vodafone customer our computer has picked YOU to win a £150 prize To collect is easy Just call 09061743386
5086	Aiya we discuss later lar Pick ü up at 4 is it
2596	That‘s the thing with apes u can fight to the death to keep something but the minute they have it when u let go thats it
3302	Just do what ever is easier for you
2978	I love u 2 my little pocy bell I am sorry but I love u
2783	Then its most likely called Mittelschmertz Google it If you dont have paracetamol dont worry it will go
2739	Hi Chachi tried calling u now unable to reach u  Pl give me a missed cal once u c tiz msg  Kanagu
3037	Rajipls do me a favour Pls convey my Birthday wishes to Nimya Pls Today is her birthday
613	Its a valentine game   Send dis msg to all ur friends  If 5 answers r d same then someone really loves u Ques which colour suits me the bestrply me
212	Whats up bruv hope you had a great break Do have a rewarding semester
4722	Forgot to tell ü smth Can ü like number the sections so that its clearer
861	Did he just say somebody is named tampa
5419	My slave I want you to take 2 or 3 pictures of yourself today in bright light on your cell phone Bright light
5076	I want to sent   mesages today Thats y Sorry if i hurts
1462	Yalru lyfu astne chikku Bt innu mundhe lyf ali halla ke bilo marriageprogram edhae so lyf is nt yet ovr chikkuali vargu lyfu meow meowD
2669	Why de You looking good only
3808	URGENT We are trying to contact you Last weekends draw shows that you have won a £900 prize GUARANTEED Call 09061701851 Claim code K61 Valid 12hours only
1061	EASTENDERS TV Quiz What FLOWER does DOT compare herself to D VIOLET E TULIP F LILY txt D E or F to 84025 NOW 4 chance 2 WIN £100 Cash WKENT150P16
2194	Congrats  Treat pendingi am not on mail for 2 dayswill mail once thruRespect mother at homecheck mails
5253	Urgent Please call 09061213237 from a landline £5000 cash or a 4 holiday await collection T Cs SAE PO Box 177 M227XY 16
5435	Thanx a lot 4 ur help
595	You still at grand prix
3944	Shes borderline but yeah whatever
3015	FREE UNLIMITED HARDCORE PORN direct 2 your mobile Txt PORN to 69200  get FREE access for 24 hrs then chrgd50p per day txt Stop 2exit This msg is free
4452	Awesome be there in a minute
4191	Well the general price is   oz let me know ifwhenhow much you want
479	Tension ahwhat machiany problem
3418	Uhhhhrmm isnt having tb test bad when youre sick
5180	Very strange  and  are watching the 2nd one now but im in bed Sweet dreams miss u
3257	HI ITS KATE CAN U GIVE ME A RING ASAP XXX
3614	K my roommate also wants a dubsack and another friend may also want some so plan on bringing extra Ill tell you when they know for sure
1277	Wot u up 2 u weirdo
4086	Quite ok but a bit ex U better go eat smth now else ill feel guilty
5232	It means u could not keep ur words
3948	How u doin baby girl  hope u are okay every time I call ure phone is off I miss u get in touch
2226	I prefer my free days Tues wed fri oso can Ü ask those workin lor
602	Mind blastin No more Tsunamis will occur from now on Rajnikant stopped swimming in Indian OceanD
1483	Im a guy browsin is compulsory
5231	PRIVATE Your 2003 Account Statement for fone no shows 800 unredeemed S I M points Call 08715203656 Identifier Code 42049 Expires 261004
114	Im ok wif it cos i like 2 try new things But i scared u dun like mah Cos u said not too loud
2516	Ok ill send you with in  DECIMAL  ok
3019	One of the joys in lifeis waking up each daywith thoughts that somewhereSomeone cares enough tosend a warm morning greeting 
1071	Jus finish bathing
1832	Thats the way you should stay oh
2697	And whenever you and i see we can still hook up too
2919	Yes that will be fine Love you Be safe
1050	I walked an hour 2 c u doesnt that show I care y wont u believe im serious
4172	Mmmmmm  I love youso much Ahmad  I cant wait for this year to begin as every second takes me closer to being at your side Happy New Year my love
2004	TheMobYo yo yoHere comes a new selection of hot downloads for our members to get for FREE Just click  open the next link sent to ur fone
2555	Ü give me some time to walk there
3763	Was just about to ask Will keep this one Maybe thats why you didnt get all the messages we sent you on glo
723	Sfine Anytime All the best with it
1088	I dont think he has spatula hands
980	Hey you can pay With salary de Only   
4813	E admin building there I might b slightly earlier Ill call u when im reaching
2841	Easy mate  guess the quick drink was bit ambitious
4559	I am in hospital da  I will return home in evening
2537	Can you pls pls send me a mail on all you know about relatives coming to deliver here All you know about costs risks benefits and anything else Thanks
1548	Shant disturb u anymore Jia you
1880	I AM AT A PARTY WITH ALEX NICHOLS
2657	Great I have to run now so ttyl
1145	And is there a way you can send shades stuff to her And she has been wonderful too
3875	Happy or sad  one thing about past is Its no more GOOD MORNING 
3592	I am in escape theatre now  Going to watch KAVALAN in a few minutes
4971	I will cme i want to go to hos 2morow After that i wil cme This what i got from her dear what to do She didnt say any time
2964	NONENOWHERE IKNO DOESDISCOUNTSHITINNIT
823	On the road so cant txt
436	You available now Im like right around hillsborough amp   th
5508	What i told before i tell Stupid hear after i wont tell anything to you You dad called to my brother and spoken Not with me
2535	Glad it went well  come over at 11 then well have plenty of time before claire goes to work
619	For my family happiness
2545	Package all your programs well
334	Call Germany for only 1 pence per minute Call from a fixed line via access number 0844 861 85 85 No prepayment Direct access
3562	Lol I know Hey someone did a great inpersonation of flea on the forums I love it
312	Today is ACCEPT DAYU Accept me as Brother Sister Lover Dear1 Best1 Clos1 Lvblefrnd Jstfrnd Cutefrnd Lifpartnr Belovd Swtheart Bstfrnd No rply means enemy
266	Why you Dint come with us
1194	I was up all night too worrying about this appt Its a shame we missed a girls night out with quizzes popcorn and you doing my hair
2375	XMAS Prize draws We are trying to contact U Todays draw shows that you have won a £2000 prize GUARANTEED Call 09058094565 from land line Valid 12hrs only
576	Nope i waiting in sch 4 daddy
4488	have  good weekend
2104	Audrie lousy autocorrect
4998	Happy new year Hope you are having a good semester
1261	We have sent JD for Customer Service cum Accounts Executive to ur mail id For details contact us
2042	You always make things bigger than they are
2113	Yar he quite clever but aft many guesses lor He got ask me 2 bring but i thk darren not so willing 2 go Aiya they thk leona still not attach wat
4006	Well theres a pattern emerging of my friends telling me to drive up and come smoke with them and then telling me that Im a weed fiendmake them smoke too muchimpede their doing other things so you see how Im hesitant
1423	Do you work all this week 
2807	I think its all still in my car
1206	WIN a year supply of CDs 4 a store of ur choice worth £500  enter our £100 Weekly draw txt MUSIC to 87066 TsCs wwwLdewcomsubs161win150ppmx3
4763	Its é only 140 ardÉ rest all ard 180 at leastWhich is é price 4 é 2 bedrm 900
1385	Please reserve ticket on saturday eve from chennai to thirunelvali and again from tirunelvali to chennai on sunday evei already see in netno ticket availablei want to book ticket through tackle 
3553	I love you both too 
4753	Your weekly CoolMob tones are ready to download This weeks new Tones include 1 Crazy FrogAXEL F 2 AkonLonely 3 Black EyedDont P More info in n
5445	I thought id get him a watch just cos thats the kind of thing u get4an18th And he loves so much
2764	ARR birthday today i wish him to get more oscar
564	Geeeee  I love you so much I can barely stand it
2158	Hey cutie How goes it Here in WALES its kinda ok There is like hills and shit but i still avent killed myself
41	Pls go ahead with watts I just wanted to be sure Do have a great weekend Abiola
3858	Im ok Will do my part tomorrow
704	What is important is that you prevent dehydration by giving her enough fluids
1863	Aiyah then i wait lor Then u entertain me Hee
1673	Glad to see your reply
5022	Its cool we can last a little while Getting more any time soon
5310	What you did in  leave
16	XXXMobileMovieClub To use your credit click the WAP link in the next txt message or click here httpwap xxxmobilemovieclubcomnQJKGIGHJJGCBL
4336	Boo what time u get out U were supposed to take me shopping today 
1307	Designation is software developer and may be she get chennai
2950	Nope but ill b going 2 sch on fri quite early lor cos mys sis got paper in da morn 
3913	How i noe Shes in da car now Later then c lar Im wearing shorts
748	I promise to take good care of you princess I have to run now Please send pics when you get a chance Ttyl
4161	Now got tv 2 watch meh U no work today
1118	Hey What time is your driving on fri We go for evaluation on fri
4699	Okey dokey i‘ll be over in a bit just sorting some stuff out
21	Is that seriously how you spell his name
1752	Got itmail panren paru
4863	Nokia phone is lovly
2686	Yupz Ive oredi booked slots 4 my weekends liao
1844	Are you comingdown later
5101	TheMobHit the link to get a premium Pink Panther game the new no 1 from Sugababes a crazy Zebra animation or a badass Hoody wallpaperall 4 FREE
4567	Honeybee Said Im d Sweetest in d World God Laughed amp Said WaitU Havnt Met d Person Reading This Msg MORAL Even GOD Can Crack Jokes GMGNGEGN
809	Boooo you always work Just quit
1400	No did you check I got his detailed message now
4809	PRIVATE Your 2004 Account Statement for 0784987 shows 786 unredeemed Bonus Points To claim call 08719180219 Identifier Code 45239 Expires 060505
2081	I can take you at like noon
3764	FREE for 1st week No1 Nokia tone 4 ur mob every week just txt NOKIA to 8007 Get txting and tell ur mates wwwgetzedcouk POBox 36504 W45WQ norm150ptone 16
4993	We made it Eta at taunton is 1230 as planned hope that‘s still okday Good to see you xx
171	Yes it completely in out of formclark also utter waste
2892	Shuhui has bought rons present its a swatch watch
2932	Wats my dear doing Sleeping ah
3066	Ok How many should i buy
7	Even my brother is not like to speak with me They treat me like aids patent
2210	URGENT Your 4 Costa Del Sol Holiday or £5000 await collection Call 09050090044 Now toClaim SAE TC s POBox334 Stockport SK38xh Cost£150pm Max10mins
3495	Cool text me when you head out
4855	Im fine Hope you are also
5012	By the way rencontre is to meet again Mountains dont
4010	Forgot you were working today Wanna chat but things are ok so drop me a text when youre free  bored etc and ill ring Hope all is well nose essay and all xx
4436	Sounds great Im going to sleep now Have a good night
4253	Omg Joanna is freaking me out Shes looked thru all my friends to find photos of me And then shes asking about stuff on my MySpace which I havent even logged on in like a year 
2182	Babe  How goes that day  What are you doing  Where are you  I sip my cappuccino and think of you my love  I send a kiss to you from across the sea
879	Sunshine Quiz Wkly Q Win a top Sony DVD player if u know which country Liverpool played in mid week Txt ansr to 82277 £150 SPTyrone
2967	Not yet hadya sapna aunty manege yday hogidhechinnu full weak and swalpa black agidhane
5395	Ooooooh I forgot to tell u I can get on yoville on my phone
2101	SMS SERVICES for your inclusive text credits pls goto wwwcomuknet login  unsubscribe with STOP no extra charge help08700469649 PO BOX420 IP4 5WE
1412	Pls speak to that customer machan
2979	Ok omw now you at castor
4491	The new deus ex game comin early next yr
3323	Yo im right by yo work
826	Have a good evening Ttyl
5154	No problem with the renewal Ill do it right away but i dont know his details
3170	Ugh hopefully the asus ppl dont randomly do a reformat
161	You are a winner U have been specially selected 2 receive £1000 cash or a 4 holiday flights inc speak to a live operator 2 claim 0871277810810
3288	Not to worry Im sure youll get it
238	Or ill be a little closer like at the bus stop on the same street
3971	Thanks for your message I really appreciate your sacrifice Im not sure of the process of direct pay but will find out on my way back from the test tomorrow Im in class now Do have a wonderful day
3171	Havent seen my facebook huh Lol
3597	Huh but i cant go 2 ur house empty handed right
2180	I dont think so You dont need to be going out that late on a school night ESPECIALLY when the one class you have is the one you missed last wednesday and probably failed a test in on friday
1491	Ok i juz receive
4509	He neva grumble but i sad lor Hee Buy tmr lor aft lunch But we still meetin 4 lunch tmr a not Neva hear fr them lei Ü got a lot of work ar
4876	Wat happened to the cruise thing
2501	Yup ive finished c ü there
2741	Are you this much buzy
1340	Aight sorry I take ten years to shower Whats the plan
4129	Sorry Ill call later
840	We tried to contact you re our offer of New Video Phone 750 anytime any network mins HALF PRICE Rental camcorder call 08000930705 or reply for delivery Wed
4194	  w jetton ave if you forgot
416	100 dating service call 09064012103 box334sk38ch
5057	Am on a train back from northampton so im afraid not Im staying skyving off today ho ho Will be around wednesday though Do you fancy the comedy club this week by the way
468	They dont put that stuff on the roads to keep it from getting slippery over there
4257	Block Breaker now comes in deluxe format with new features and great graphics from TMobile Buy for just £5 by replying GET BBDELUXE and take the challenge
2757	We r outside already
3598	Good morning princess Happy New Year
1556	Yeah we do totes When u wanna
4735	Good Morning my Dear Shijutta Have a great amp successful day
4709	Wif my family booking tour package
4152	I only work from mon to thurs but Sat i cant leh Booked liao Which other day u free
3622	I meant as an apology from me for texting you to get me drugs at   at night
276	No objection My bf not coming
4079	Hey sathya till now we dint meet not even a single time then how can i saw the situation sathya
2810	Yes princess I want to catch you with my big strong hands
3157	Ok
3306	IM GONNAMISSU SO MUCHI WOULD SAY IL SEND U A POSTCARD BUTTHERES ABOUTAS MUCH CHANCE OF MEREMEMBERIN ASTHERE IS OFSI NOT BREAKIN HIS CONTRACT LUV Yaxx
3573	But you dint in touch with me
5117	Argh why the fuck is nobody in town 
3152	Yo Howz u girls never rang after india L
5280	Best msg Its hard to be with a person when u know that one more step foward will make u fall in love amp One step back can ruin ur friendship good night 
3050	Die Now i have e toot fringe again
58	Sorry Ill call later in meeting
