4415	Sad story of a Man  Last week was my bday My Wife didnt wish me My Parents forgot n so did my Kids  I went to work Even my Colleagues did not wish
115	GENT We are trying to contact you Last weekends draw shows that you won a £1000 prize GUARANTEED Call 09064012160 Claim Code K52 Valid 12hrs only 150ppm
5274	So u wan 2 come for our dinner tonight a not
3194	Is ur paper today in e morn or aft
2663	Do you know when dad will be back
4404	Good FRIENDS CaRE for each Other CLoSE Friends UNDERSTaND each Other and TRUE Friends STaY forever beyond words beyond time Gud ni8
1868	Or ü go buy wif him then i meet ü later can
517	Sno competition for him
1059	Ard 515 like dat Y
2421	SMS SERVICES For your inclusive text credits pls gotto wwwcomuknet login 3qxj9 unsubscribe with STOP no extra charge help 08702840625 comuk220cm2 9AE
5263	If anyone calls for a treadmill say youll buy it Make sure its working I found an ad on Craigslist selling for   
4100	I think just yourself …Thanks and see you tomo
4376	K and youre sure I dont have to have consent forms to do it V
3800	Feb    is I LOVE U day Send dis to all ur VALUED FRNDS evn me If 3 comes back ull gt married d person u luv If u ignore dis u will lose ur luv 4 Evr
2981	Xmas Offer Latest Motorola SonyEricsson  Nokia  FREE Bluetooth or DVD Double Mins  1000 Txt on Orange Call MobileUpd8 on 08000839402 or call2optout4QF2
320	December only Had your mobile 11mths You are entitled to update to the latest colour camera mobile for Free Call The Mobile Update Co FREE on 08002986906
567	Ill call u 2mrw at ninish with my address that icky American freek wont stop callin me 2 bad Jen k eh
1932	Carry on not disturbing both of you
3101	Ok I din get ur msg
936	Dear Matthew please call 09063440451 from a landline your complimentary 4Lux Tenerife holiday or £1000 CASH await collection ppm150 SAE TCs Box334 SK38XH
626	Nah its straight if you can just bring bud or drinks or something thats actually a little more useful than straight cash
1270	Can U get 2 phone NOW I wanna chat 2 set up meet Call me NOW on 09096102316 U can cum here 2moro Luv JANE xx Calls£1minmoremobsEMSPOBox45PO139WA
1881	U have a secret admirer who is looking 2 make contact with Ufind out who they Rreveal who thinks UR so specialcall on 09058094594
3850	Can you plz tell me the ans BSLVYL sent via fullonsmscom
526	URGENT Your Mobile No was awarded a £2000 Bonus Caller Prize on 020903 This is our 2nd attempt to contact YOU Call 08718729755 BOX95QU
899	Im used to it I just hope my agents dont drop me since ive only booked a few things this year This whole me in boston them in nyc was an experiment
4754	Well boy am I glad G wasted all night at applebees for nothing
4618	Ü called dad oredi
3907	Do you want a new video handset 750 anytime any network mins Half Price Line Rental Camcorder Reply or call 08000930705 for delivery tomorrow
4740	I bought the test yesterday Its something that lets you know the exact day u ovulatewhen will get 2u in about 2 to 3wks But pls pls dont fret I know u r worried Pls relax Also is there anything in ur past history u need to tell me
2007	Cant take any major roles in community outreach You rock mel
2013	Do whatever you want You know what the rules are We had a talk earlier this week about what had to start happening you showing responsibility Yet every week its can i bend the rule this way What about that way Do whatever Im tired of having thia same argument with you every week And a    movie DOESNT inlude the previews Youre still getting in after 1
4268	The greatest test of courage on earth is to bear defeat without losing heartgn tc
30	Ahhh Work I vaguely remember that What does it feel like Lol
1771	Ha Both of us doing e same thing But i got tv 2 watch U can thk of where 2 go tonight or u already haf smth in mind
1942	Dude avatar 3d was imp At one point i thought there were actually flies in the room and almost tried hittng one as a reflex
4412	You also didnt get na hi hi hi hi hi
1167	Haha yeah I see that now be there in a sec
2181	And popping  ibuprofens was no help
4243	Detroit The home of snow Enjoy it
1461	Bought one ringtone and now getting texts costing 3 pound offering more tones etc
1593	Thats my honeymoon outfit 
2566	Under the sea there lays a rock In the rock there is an envelope In the envelope there is a paper On the paper there are 3 words 
1037	Hello baby did you get back to your moms  Are you setting up the computer now  Filling your belly  How goes it loverboy  I miss you already  sighs
5423	I dont know oh Hopefully this month
1329	Ur balance is now £500 Ur next question is Who sang Uptown Girl in the 80s  2 answer txt ur ANSWER to 83600 Good luck
3528	HEY BABE FAR 2 SPUNOUT 2 SPK AT DA MO DEAD 2 DA WRLD BEEN SLEEPING ON DA SOFA ALL DAY HAD A COOL NYTHO TX 4 FONIN HON CALL 2MWEN IM BK FRMCLOUD 9 J X
4508	When are you guys leaving
2629	I know Im lacking on most of this particular dramastorms details but for the most part Im not worried about that
890	You unbelievable faglord
4596	I had a good time too Its nice to do something a bit different with my weekends for a change See ya soon
5286	Yeah probably here for a while
1144	Have you had a good day Mine was really busy are you up to much tomorrow night
1625	Ah well that confuses things doesn‘t it
1231	Jus ans me lar Ull noe later
1469	I wont touch you with out your permission
1160	Hey Theres veggie pizza 
3785	Can you do online transaction
2204	And my man carlos is definitely coming by mu tonight no excuses
1086	For me the love should start with attractioni should feel that I need her every time around meshe should be the first thing which comes in my thoughtsI would start the day and end it with hershe should be there every time I dreamlove will be then when my every breath has her namemy life should happen around hermy life will be named to herI would cry for herwill give all my happiness and take all her sorrowsI will be ready to fight with anyone for herI will be in love when I will be doing the craziest things for herlove will be when I dont have to proove anyone that my girl is the most beautiful lady on the whole planetI will always be singing praises for herlove will be when I start up making chicken curry and end up makiing sambarlife will be the most beautiful thenwill get every morning and thank god for the day because she is with meI would like to say a lotwill tell later
1081	Me too watching surya movie only  after 6 pm vijay movie POKKIRI
2625	Im coming home 4 dinner
3687	Wake me up at    am morning
4889	Todays Vodafone numbers ending with 4882 are selected to a receive a £350 award If your number matches call 09064019014 to receive your £350 award
4653	A £400 XMAS REWARD IS WAITING FOR YOU Our computer has randomly picked you from our loyal mobile customers to receive a £400 reward Just call 09066380611
4117	Sorry You never hear unless you book it One was kinda a jokethet were really looking for skinny white girls The other was one lineyou can only do so much on camera with that Something like that theyre casting on the look
1494	In the end she might still vomit but its okay Not everything will come out
407	Haha get used to driving to usf man I know a lot of stoners
4004	Did you get any gift This year i didnt get anything So bad
946	I sent my scores to sophas and i had to do secondary application for a few schools I think if you are thinking of applying do a research on cost also Contact joke ogunrinde her school is one me the less expensive ones
5025	Anyway holla at me whenever youre around because I need an excuse to go creep on people in sarasota
4850	Sthis will increase the chance of winning
3005	I will see in half an hour
4354	Hows the pain deary r u smiling
3175	Dear Voucher Holder To claim this weeks offer at you PC please go to httpwwwetlpcoukreward TsCs apply
1312	Ill always be there even if its just in spirit Ill get a bb soon Just trying to be sure i need it
288	Ok
1996	Have you been practising your curtsey
1509	Wen ur lovable bcums angry wid u dnt take it seriously Coz being angry is d most childish n true way of showing deep affection care n luv kettoda manda Have nice day da
5472	Ok lor
3566	Do you always celebrate NYs with your family 
5443	Thank you do you generally date the brothas
180	Text her If she doesnt reply let me know so i can have her log in
5573	The guy did some bitching but I acted like id be interested in buying something else next week and he gave it to us for free
142	K text me when youre on the way
4109	HOT LIVE FANTASIES call now 08707500020 Just 20p per min NTT Ltd PO Box 1327 Croydon CR9 5WB 0870 is a national rate call
681	Missed your call cause I was yelling at scrappy Miss u Cant wait for u to come home Im so lonely today
903	How is it possible to teach you And where
2459	Kkhow is your sister kids
362	Ha ha cool cool chikku chikkuDB
5496	I think if he rule tamilnaduthen its very tough for our people
4217	No dear i was sleeping P
4219	Will be office around 4 pm Now i am going hospital
3138	Can you let me know details of fri when u find out cos Im not in tom or fri mentionned chinese Thanks
2666	He remains a bro amongst bros
5203	Call Germany for only 1 pence per minute Call from a fixed line via access number 0844 861 85 85 No prepayment Direct access wwwtelediscountcouk
5032	Is there coming friday is leave for pongaldo you get any news from your work place
2276	Think I could stop by in like an hour or so My roommates looking to stock up for a trip
1926	Ok
1285	Yes i thought so Thanks
2728	No i am not having not any movies in my laptop
3841	Erm … ill pick you up at about 645pm Thatll give enough time to get there park and that
3352	Sorry i cant take your call right now It so happens that there r 2waxsto do wat you want She can come and ill get her medical insurance And shell be able to deliver and have basic care Im currently shopping for the right medical insurance for her So just give me til friday morning Thats when ill see the major person that can guide me to the right insurance
3582	Have a lovely night and when you wake up to see this message i hope you smile knowing all is as should be Have a great morning
1052	Are you available for soiree on June 3rd
4367	Ujhhhhhhh computer shipped out with address to sandiago and parantella lane Wtf Poop
1606	God picked up a flower and dippeditinaDEW lovingly touched itwhichturnedinto u and the he gifted tomeandsaidTHIS FRIEND IS 4U
4222	U free on sat rite U wan 2 watch infernal affairs wif me n darren n mayb xy
5056	Double Mins  Double Txt  12 price Linerental on Latest Orange Bluetooth mobiles Call MobileUpd8 for the very latest offers 08000839402 or call2optoutLF56
699	meet you in corporation st outside gap … you can see how my mind is working
1006	Umma Did she say anything
1595	PRIVATE Your 2003 Account Statement for shows 800 unredeemed S I M points Call 08719899230 Identifier Code 41685 Expires 071104
4538	Never blame a day in ur life Good days give u happiness Bad days give u experience Both are essential in life All are Gods blessings good morning
1289	What do you do my dog  Must I always wait till the end of your day to have word from you  Did you run out of time on your cell already
2132	Later i guess I needa do mcat study too
1777	Did u see what I posted on your Facebook
4797	Saw Guys and Dolls last night with Patrick Swayze it was great
3536	Good evening How are you
177	Let me know when youve got the money so carlos can make the call
4091	How are you my Love  Are you with your brother  Time to talk english with him  grins Say  Hey Muhommad Penny says hello from across the sea
3826	I miss you so much Im so desparate I have recorded the message you left for me the other day and listen to it just to hear the sound of your voice I love you
4021	Uve been selected to stay in 1 of 250 top British hotels  FOR NOTHING Holiday valued at £350 Dial 08712300220 to claim  National Rate Call Bx526 SW73SS
3775	I came hostel I m going to sleep Plz call me up before class Hrishi
3231	Ur cashbalance is currently 500 pounds  to maximize ur cashin now send COLLECT to 83600 only 150pmsg CC 08718720201 PO BOX 11414 TCRW1
146	Yes see ya not on the dot
5165	Just send a text Well skype later
5301	Ill hand her my phone to chat wit u
5047	We have sent JD for Customer Service cum Accounts Executive to ur mail id For details contact us
5447	Good morning At the repair shopthe ONLY reason im up at this hour
1547	Good afternoon my love  Any job prospects  Are you missing me  What do you do  Are you being lazy and bleak hmmm  Or happy and filled with my love 
3024	How dare you change my ring
1745	I love to wine and dine my lady
333	Maybe i could get book out tomo then return it immediately  Or something
5515	Just making dinner you 
2463	Anything lar
4477	We will meet soon princess Ttyl
5139	There are some nice pubs near here or there is Frankie n Bennys near the warner cinema
792	This is hoping you enjoyed your game yesterday Sorry ive not been in touch but pls know that you are fondly bein thot off Have a great week Abiola
5044	Jamster To get your free wallpaper text HEART to 88888 now TC apply 16 only Need Help Call 08701213186
5174	Oh k  I will come tomorrow
2984	Tonight Yeah Id be down for that
2799	If I get there before you after your ten billion calls and texts so help me god
3652	We are hoping to get away by 7 from Langport You still up for town tonight
417	Whatsup there Dont u want to sleep
4612	Just glad to be talking to you
4584	Wow didnt think it was that common I take it all back ur not a freak Unless u chop it off
4007	 ow u deyi paid 60400thousadi told  u would call 
4720	My uncles in Atlanta Wish you guys a great semester
4585	For ur chance to win a £250 wkly shopping spree TXT SHOP to 80878 TsCs wwwtxt2shopcom custcare 08715705022 1x150pwk
1485	Purity of friendship between two is not about smiling after reading the forwarded messageIts about smiling just by seeing the name Gud evng musthu
2310	Moby Pub QuizWin a £100 High Street prize if u know who the new Duchess of Cornwall will be Txt her first name to 82277unsub STOP £150 008704050406 SP Arrow
3465	i am seeking a lady in the street and a freak in the sheets Is that you
2394	Thanks da thangam i feel very very happy dear I also miss you da
2354	Thats cool How was your day
5090	Good morning im suffering from fever and dysentry will not be able to come to office today
5436	Youre gonna have to be way more specific than that
4512	This weekend is fine an excuse not to do too much decorating
3753	Haha Sounds crazy dunno can tahan anot
4288	Congrats Thats great I wanted to tell you not to tell me your score cos it might make me relax But its motivating me so thanks for sharing
3197	Great P diddy is my neighbor and comes for toothpaste every morning
1448	Looks like u wil b getting a headstart im leaving here bout 230ish but if u r desperate for my company I could head in earlierwe were goin to meet in rummer
2562	Are you still getting the goods
2829	Oh right ok Ill make sure that i do loads of work during the day  got a really nasty cough today and is dry n shot so that should really help it
3825	Please protect yourself from ethreats SIB never asks for sensitive information like PasswordsATMSMS PIN thru email Never share your password with anybody
4836	I hope your pee burns tonite
5064	Havent stuck at orchard in my dads car Going 4 dinner now U leh So r they free tonight
131	Kkhow much does it cost
3390	Same as kallis dismissial in 2nd test
765	Nothing but we jus tot u would ask cos u ba gua But we went mt faber yest Yest jus went out already mah so today not going out Jus call lor
3284	Hey you around Ive got enough for a half  the ten I owe you
4940	No it was cancelled yeah baby Well that sounds important so i understand my darlin give me a ring later on this fone love Kate x
357	Thank You for callingForgot to say Happy Onam to you SirjiI am fine here and remembered you when i met an insurance personMeet You in Qatar Insha AllahRakhesh ex Tata AIG who joined TISSCOTayseer
4019	Eek thats a lot of time especially since American Pie is like 8 minutes long I cant stop singing it
1784	My uncles in Atlanta Wish you guys a great semester
1725	Hi Jon Pete here Ive bin 2 Spain recently  hav sum dinero left Bill said u or ur rents mayb interested in it I hav 12000pes so around £48 tb James
1663	You arent coming home between class right I need to work out and shower
377	Can you say what happen
2357	Hello my love  How went your day  Are you alright  I think of you my sweet and send a jolt to your heart to remind you  I LOVE YOU Can you hear it  I screamed it across the sea for all the world to hear Ahmad al Hallaq is loved  and owned  possessive passionate kiss
4947	Anyway I dont think I can secure anything up here lemme know if you want me to drive down south and chill
2911	URGENT Your Mobile number has been awarded with a £2000 prize GUARANTEED Call 09058094454 from land line Claim 3030 Valid 12hrs only
3190	This is the 2nd time we have tried 2 contact u U have won the 750 Pound prize 2 claim is easy call 08712101358 NOW Only 10p per min BTnationalrate
1296	Aiyah u did ok already lar E nydc at wheellock
2626	S daal r above
1079	Yep by the pretty sculpture
1415	Dear Uve been invited to XCHAT This is our final attempt to contact u Txt CHAT to 86688 150pMsgrcvdHGSuite3422LandsRowW1J6HL LDN 18 yrs
2584	3 FREE TAROT TEXTS Find out about your love life now TRY 3 FOR FREE Text CHANCE to 85555 16 only After 3 Free Msgs £150 each
968	I am not sure about night menu   I know only about noon menu
1428	Ok
2486	Only if you promise your getting out as SOON as you can And youll text me in the morning to let me know you made it in ok
4549	Hey mate Spoke to the mag people We‘re on  the is deliver by the end of the month Deliver on the 24th sept Talk later
2096	PRIVATE Your 2004 Account Statement for 07742676969 shows 786 unredeemed Bonus Points To claim call 08719180248 Identifier Code 45239 Expires
5277	Hi Hope ur day  good Back from walk table booked for half eight Let me know when ur coming over
2826	No need to buy lunch for me I eat maggi mee
805	You have won a guaranteed £200 award or even £1000 cashto claim UR award call free on 08000407165 18 2 stop getstop on 88222 PHP RG21 4JX
2999	Don knowhe is watching film in computer
5519	Ya im referin to meis ex wat No ah waitin 4 u to treat somebody shld b rich liaoSo gd den u dun have to work frm tmr onwards
2441	Rightio 1148 it is then Well arent we all up bright and early this morning
3319	No worries hope photo shoot went well have a spiffing fun at workage
2447	The guy kadeem hasnt been selling since the break I know one other guy but hes paranoid as fuck and doesnt like selling without me there and I cant be up there til late tonight
3435	Christmas is An occasion that is Celebrated as a Reflection of UR Values Desires Affectionsamp Traditions Have an ideal Christmas
2087	Moji i love you more than words Have a rich day
4553	Great Have a safe trip Dont panic surrender all
2470	Lol well dont do it without me We could have a big sale together
47	Didnt you get hep b immunisation in nigeria
1154	Ok i go change also
1300	Your daily text from me – a favour this time
64	Sorry my roommates took forever it ok if I come by now
1688	todays vodafone numbers ending with 0089my last four digits are selected to received a £350 award If your number matches please call 09063442151 to claim your £350 award
987	Carlos says hell be at mu in    minutes
4845	I need details about that online job
1561	Single line with a big meaning Miss anything 4 ur Best Life but dont miss ur best life for anything Gud nyt
4964	Yup ok
5404	Babes I think I got ur brolly I left it in English wil bring it in 2mrw 4 u luv Franxx
3060	You are now unsubscribed all services Get tons of sexy babes or hunks straight to your phone go to httpgotbabescouk No subscriptions
4996	My drive can only be read I need to write
454	Kkwhat are detail you want to transferacc no enough
4629	Please call our customer service representative on 0800 169 6031 between 10am9pm as you have WON a guaranteed £1000 cash or £5000 prize
1460	Fighting with the world is easy u either win or lose bt fightng with some1 who is close to u is dificult if u lose  u lose if u win  u still lose
3383	complimentary 4 STAR Ibiza Holiday or £10000 cash needs your URGENT collection 09066364349 NOW from Landline not to lose out Box434SK38WP150PPM18
2561	I also thk too fast Xy suggest one not me U dun wan its ok Going 2 rain leh where got gd
3915	Yeah whatever lol
5387	How are you babes Hope your doing ok I had a shit nights sleep I fell asleep at 5Im knackered and im dreading work tonight What are thou upto tonight X
2313	Congratulations Thanks to a good friend U have WON the £2000 Xmas prize 2 claim is easy just call 08718726971 NOW Only 10p per minute BTnationalrate
3287	They are just making it easy to pay back I have   yrs to say but i can pay back earlier You get
4186	I just really need shit before tomorrow and I know you wont be awake before like 6
1244	Nobody can decide where to eat and dad wants Chinese
2891	My battery is low babe
2169	Yeshe have good crickiting mind
1549	Bishan lar nearer No need buy so early cos if buy now i gotta park my car
5187	Im in town now so ill jus take mrt down later
1099	Dont fret Ill buy the ovulation test strips and send them to you You wont get them til like march Can you send me your postal addressull be alrightOkay
106	Umma my life and vava umma love you lot dear
2643	You are guaranteed the latest Nokia Phone a 40GB iPod MP3 player or a £500 prize Txt word COLLECT to No 83355 IBHltd LdnW15H 150pMtmsgrcvd18
445	Sorry Ill call later
2314	tddnewsletteremc1couk More games from TheDailyDraw Dear Helen Dozens of Free Games  with great prizesWith
4448	Merry christmas to u too annie
14	Ive been searching for the right words to thank you for this breather I promise i wont take your help for granted and will fulfil my promise You have been wonderful and a blessing at all times
1541	Youre not sure that Im not trying to make xavier smoke because I dont want to smoke after being told I smoke too much
5152	Pls call me da What happen
2604	So when you gonna get rimac access
1662	No just send to you Bec you in temple na
4517	That was random saw my old roomate on campus He graduated
5540	Want explicit SEX in 30 secs Ring 02073162414 now Costs 20pmin Gsex POBOX 2667 WC1N 3XX
4377	Ur TONEXS subscription has been renewed and you have been charged £450 You can choose 10 more polys this month wwwclubzedcouk BILLING MSG
478	Love you aathilove u lot
1888	Dear 0776xxxxxxx Uve been invited to XCHAT This is our final attempt to contact u Txt CHAT to 86688 150pMsgrcvdHGSuite3422LandsRowW1J6HL LDN 18yrs
3494	I will reach office around  DECIMAL  amp my mobile have problem You cannt get my voice So call you asa ill free
1737	Why tired what special there you had
4718	Hey What happened U switch off ur cell d whole day This isnt good Now if u do care give me a call tomorrow
2367	Ok try to do week end course in coimbatore
2784	Well at this right Im gonna have to get up and check todays steam salespee so text me when you want me to come get you
5233	Nope Im still in the market
862	In work now Going have in few min
5077	This is the 2nd attempt to contract U you have won this weeks top prize of either £1000 cash or £200 prize Just call 09066361921
5501	Why did I wake up on my own 
3891	Unlimited texts Limited minutes
1157	Sorry man accidentally left my phone on silent last night and didnt check it til I got up
4274	Where to get those
18	Eh u remember how 2 spell his name Yes i did He v naughty make until i v wet
1519	Our brand new mobile music service is now live The free music player will arrive shortly Just install on your phone to browse content from the top artists
1825	Same as u Dun wan Y u dun like me already ah Wat u doing now Still eating
2639	No I dont have cancer Moms making a big deal out of a regular checkup aka pap smear
1356	Baaaaabe I misss youuuuu  Where are you  I have to go and teach my class at 5 
2949	Leave it U will always be ignorant
2325	Sorry dude Dont know how i forgot Even after Dan reminded me Sorry Hope you guys had fun
3064	Fine Do you remember me
3236	Yup ü not comin 
1368	Bbq this sat at mine from 6ish Ur welcome 2 come
3919	Eh ur laptop got no stock lei He say mon muz come again to take a look c got a not
923	On ma way to school Can you pls send me ashleys number
3833	Lets pool our money together and buy a bunch of lotto tickets If we win I get   u get   Deal
1280	Can i meet ü at 5 As 4 where depends on where ü wan 2 in lor
948	Ur cashbalance is currently 500 pounds  to maximize ur cashin now send GO to 86688 only 150pmsg CC 08718720201 PO BOX 11414 TCRW1
1658	Yes I posted a couple of pics on fb Theres still snow outside too Im just waking up 
3581	Multiply the numbers independently and count decimal points then for the division push the decimal places like i showed you
2340	Alright see you in a bit
2613	Knock Knock Txt whose there to 80082 to enter r weekly draw 4 a £250 gift voucher 4 a store of yr choice TCs wwwtklscom age16 to stoptxtstop£150week
3914	You have an important customer service announcement Call FREEPHONE 0800 542 0825 now
3874	I am joining today formallyPls keep prayingwill talk later
3025	You are a very very very very bad girl Or lady
3027	What part of dont initiate dont you understand
4651	Please protect yourself from ethreats SIB never asks for sensitive information like PasswordsATMSMS PIN thru email Never share your password with anybody
2299	Draw vai dont think so
5196	Its wylie you in tampa or sarasota
5330	Wishing you a wonderful week
4758	Dont make life too stressfull Always find time to Laugh It may not add years to your Life But surely adds more life to ur years Gud ni8swt dreams
51	What you thinked about me First time you saw me in class
1919	We not leaving yet Ok lor then we go elsewhere n eat U thk
