2665	8007 FREE for 1st week No1 Nokia tone 4 ur mob every week just txt NOKIA to 8007 Get txting and tell ur mates wwwgetzedcouk POBox 36504 W4 5WQ norm 150ptone 16
1383	We spend our days waiting for the ideal path to appear in front of us But what we forget is paths are made by walking not by waiting Goodnight
4355	Fun fact although you would think armand would eventually build up a tolerance or some shit considering how much he smokes he gets fucked up in like 2 hits
1112	Ok ill tell the company
3546	Lol ok ill try to send Be warned Sprint is dead slow Youll prolly get it tomorrow
5311	Im coming back on Thursday Yay Is it gonna be ok to get the money Cheers Oh yeah and how are you Everything alright Hows school Or do you call it work now
1416	So wats ur opinion abt him and how abt is character
5499	Yes I trust u to buy new stuff ASAP so I can try it out
855	AH POOR BABYHOPE URFEELING BETTERSN LUV PROBTHAT OVERDOSE OF WORK HEY GO CAREFUL SPK 2 U SN LOTS OF LOVEJEN XXX
2760	What time I‘m out until prob 3 or so
2489	K ill drinkpa then what doing I need srs model pls send it to my mail id pa
1911	Then u going ikea str aft dat
2848	Wat time u finish ur lect today
674	Get ur 1st RINGTONE FREE NOW Reply to this msg with TONE Gr8 TOP 20 tones to your phone every week just £150 per wk 2 opt out send STOP 08452810071 16
1468	Your account has been refilled successfully by INR  DECIMAL  Your KeralaCircle prepaid account balance is Rs  DECIMAL  Your Transaction ID is KR  
986	Yo guess what I just dropped
1173	Got what it takes 2 take part in the WRC Rally in Oz U can with Lucozade Energy Text RALLY LE to 61200 25p see packs or lucozadecoukwrc  itcould be u
1857	Kyou are the only girl waiting in reception ah
631	Todays Vodafone numbers ending with 4882 are selected to a receive a £350 award If your number matches call 09064019014 to receive your £350 award
1528	Wow  I love you sooo much you know  I can barely stand it  I wonder how your day goes and if you are well my love  I think of you and miss you
3651	Hmm ill have to think about it ok youre forgiven D
3313	HI DARLIN HOW WAS WORK DID U GET INTO TROUBLE IJUST TALKED TO YOUR MUM ALL MORNING I HAD A REALLY GOOD TIME LAST NIGHT IM GOIN OUT SOON BUT CALL ME IF U CAN
3952	I got to video tape pple type in message lor U so free wan 2 help me Hee Cos i noe u wan 2 watch infernal affairs so ask u along Asking shuhui oso
1756	How is your schedule next week I am out of town this weekend
1647	Ill post her out l8r In class
9	WINNER As a valued network customer you have been selected to receivea £900 prize reward To claim call 09061701461 Claim code KL341 Valid 12 hours only
900	Thursday night Yeah sure thing well work it out then
4196	Can not use foreign stamps in this country
1313	U r too much close to my heart If u go away i will be shattered Plz stay with me
4634	Im in a meeting call me later at
2099	Are you the cutest girl in the world or what
4200	Want to funk up ur fone with a weekly new tone reply TONES2U 2 this text wwwringtonescouk the original n best Tones 3GBP network operator rates apply
5429	Oh yeah And my diet just flew out the window
4103	GSOH Good with SPAM the ladiesU could b a male gigolo 2 join the uks fastest growing mens club reply ONCALL mjzgroup 087143423992stop reply STOP msg£150rcvd
2448	Sorry Ill call later
3004	Excellent Ill see what rileys plans are
4590	I wanted to wish you a Happy New Year and I wanted to talk to you about some legal advice to do with when Gary and I split but in person Ill make a trip to Ptbo for that I hope everything is good with you babe and I love ya 
2806	Lil fever now fine
5036	I want to go to perumbavoor
5170	Oh did you charge camera
1834	What time is ur flight tmr
3596	Do you want a New Nokia 3510i Colour Phone Delivered Tomorrow With 200 FREE minutes to any mobile  100 FREE text  FREE camcorder Reply or Call 08000930705
2363	Hi Im sorry i missed your call Can you pls call back
5248	Thank you princess I want to see your nice juicy booty
4495	LOL  grins  Im not babe but thanks for thinking of me
4245	Okie
3096	Have you emigrated or something Ok maybe 530 was a bit hopeful
4464	Sorry I flaked last night shits seriously goin down with my roommate what you up to tonight
5058	Goodnight da thangam I really miss u dear
3587	Heart is empty without love Mind is empty without wisdom Eyes r empty without dreams amp Life is empty without frnds So Alwys Be In Touch Good night amp sweet dreams
629	Yup i thk they r e teacher said that will make my face look longer Darren ask me not 2 cut too short
2295	Hello Damn this christmas thing I think i have decided to keep this mp3 that doesnt work
1198	What he said is not the matter My mind saying some other matter is there
1931	Free 1st week entry 2 TEXTPOD 4 a chance 2 win 40GB iPod or £250 cash every wk Txt VPOD to 81303 TsCs wwwtextpodnet custcare 08712405020
5007	Guess which pub im in Im as happy as a pig in clover or whatever the saying is
759	Faith makes things possibleHope makes things workLove makes things beautifulMay you have all three this ChristmasMerry Christmas
3487	Noi got rumour that you going to buy apartment in chennai
1668	Guess who spent all last night phasing in and out of the fourth dimension
1492	Cant believe i said so many things to you this morning when all i really wanted to say was good morning i love you Have a beautiful morning See you in the library later
2921	Is xy in ur car when u picking me up
4724	Im home my love  If your still awake  loving kiss
1507	Total video converter free download type this in google search
150	Ki deleted my contact that why
1142	Ohas usual vijay film or its different
1579	Remember all those whom i hurt during days of satanic imposter in meneed to pay a priceso be itmay destiny keep me going and as u said pray that i get the mind to get over the same
3718	Networking technical support associate
5005	CDs 4u Congratulations ur awarded £500 of CD gift vouchers or £125 gift guaranteed  Freeentry 2 £100 wkly draw xt MUSIC to 87066 TnCs wwwldewcom1win150ppmx3age16
3393	Im in a meeting call me later at
5304	At WHAT TIME should i come tomorrow
4951	I am in bus on the way to calicut
3061	Dear all as we know   th is the   th birthday of our loving Gopalettan We are planning to give a small gift on that day Those who like to participate in that you are welcome Please contact our admin team for more details
1637	You have come into my life and brought the sun Shiny down on me warming my heart Putting a constant smile on my face  Making me feel loved and cared for
1504	Don no dawhats you plan
3110	Hello hun how ru Its here by the way Im good Been on 2 dates with that guy i met in walkabout so far We have to meet up soon Hows everyone else
186	Going on nothing greatbye
1998	Lol boo I was hoping for a laugh
4717	S8 min to go for lunch
3252	Babe I need your advice
2213	Just gettin a bit arty with my collages at the mo well tryin 2 ne way Got a roast in a min lovely i shall enjoy that
547	Then any special there
2822	INTERFLORA  Its not too late to order Interflora flowers for christmas call 0800 505060 to place your order before Midnight tomorrow
2142	After the drug she will be able to eat
3539	Mmmmm  It was sooooo good to wake to your words this morning my Love Mmmm fuck  I love you too my Lion  devouring kiss from across the sea
3121	Stop knowing me so well
5374	Lol oh you got a friend for the dog 
3613	No Ill meet you in the library
245	Although i told u dat im into baig face watches now but i really like e watch u gave cos its fr u Thanx 4 everything dat uve done today im touched
259	Where are you lover  I need you 
2802	HouseMaid is the murderer coz the man was murdered on   th January As public holiday all govtinstituitions are closedincluding post office
4768	Whens your radio show
2403	Babe U want me dont u baby Im nasty and have a thing 4 filthyguys Fancy a rude time with a sexy bitch How about we go slo n hard Txt XXX SLO4msgs
4595	Its ok i wun b angry Msg u aft i come home tonight
562	Hi msg meim in office
2130	Well Im going to be an aunty
3887	Like a personal sized or what
4089	PRIVATE Your 2003 Account Statement for 07973788240 shows 800 unredeemed S I M points Call 08715203649 Identifier Code 40533 Expires 311004
4692	Ok no prob
5026	Where you What happen
5321	Good morning my Love  I go to sleep now and wish you a great day full of feeling better and opportunity  You are my last thought babe I LOVE YOU kiss
2768	Married local women looking for discreet action now 5 real matches instantly to your phone Text MATCH to 69969 Msg cost 150p 2 stop txt stop BCMSFWC1N3XX
851	Todays Offer Claim ur £150 worth of discount vouchers Text YES to 85023 now SavaMob member offers mobile T Cs 08717898035 £300 Sub 16  Unsub reply X
2187	Purity of friendship between two is not about smiling after reading the forwarded messageIts about smiling just by seeing the name Gud evng
3557	From next month get upto 50 More Calls 4 Ur standard network charge 2 activate Call 9061100010 C Wire3net 1st4Terms PoBox84 M26 3UZ Cost £150 min MobcudB more
3885	Gumbys has a special where a    cheese pizza is 2 so I know what were doin tonight
4680	It is a good thing Im now getting the connection to bw
1192	Were done
1624	U have a secret admirer who is looking 2 make contact with Ufind out who they Rreveal who thinks UR so specialcall on 09058094599
836	Surely result will offer
5323	But we havent got da topic yet rite
4844	Awesome that gonna be soon or later tonight
4838	Yay cant wait to party together
203	Hello darlin ive finished college now so txt me when u finish if u can love Kate xxx
4169	Are you at work right now 
3177	UR GOING 2 BAHAMAS CallFREEFONE 08081560665 and speak to a live operator to claim either Bahamas cruise of£2000 CASH 18only To opt out txt X to 07786200117
962	U sure u cant take any sick time
4644	You are being ripped off Get your mobile content from wwwclubmobycom call 08717509990 polytruePixRingtonesGames six downloads for only 3
1802	excellent I spent    years in the Air Force Iraq and afghanistan I am stable and honest do you like traveling
4770	Im not sure if its still available though
4686	My life Means a lot to me Not because I love my life But because I love the people in my life The world calls them friends I call them my World Ge
5210	Babe Im answering you cant you see me  Maybe youd better reboot YM  I got the photo  Its great 
2615	Thanks for sending this mental ability question
3667	Ha U jus ate honey ar So sweet
4308	Awww dat is sweet We can think of something to do he he Have a nice time tonight ill probably txt u later cos im lonely  xxx
153	Yup i thk cine is better cos no need 2 go down 2 plaza mah
5013	You have WON a guaranteed £1000 cash or a £2000 prize To claim yr prize call our customer service representative on 08714712412 between 10am7pm Cost 10p
4158	Yo call me when you get the chance a friend of mine wanted me to ask you about a big order
472	okmail Dear Dave this is your final notice to collect your 4 Tenerife Holiday or 5000 CASH award Call 09061743806 from landline TCs SAE Box326 CW25WX 150ppm
2769	Wow v v impressed Have funs shopping
4266	She just broke down a list of reasons why nobodys in town and I cant tell if shes being sarcastic or just faggy
1763	Got ur mail Dileepthank you so muchand look forward to lots of supportvery less contacts hereremember one venugopal you mentionedtomorrow if not latei shall try to come up till theregoodnight dear
2645	Hi You just spoke to MANEESHA V Wed like to know if you were satisfied with the experience Reply Toll Free with Yes or No
3829	Congratulations U can claim 2 VIP row A Tickets 2 C Blu in concert in November or Blu gift guaranteed Call 09061104276 to claim TSCs wwwsmsconet cost£375max
2527	Say this slowly GODI LOVE YOU amp I NEED YOUCLEAN MY HEART WITH YOUR BLOODSend this to Ten special people amp u c miracle tomorrow do itplspls do it
2341	Cheers for the message Zogtorius Ive been staring at my phone for an age deciding whether to text or not
816	U were outbid by simonwatson5120 on the Shinco DVD Plyr 2 bid again visit sms acsmsrewards 2 end bid notifications reply END OUT
3794	Love it I want to flood that pretty pussy with cum
2570	Hey For me there is no leave on friday Wait i will ask my superior and tell you
2388	No messageno responcewhat happend
1715	Hard LIVE 121 chat just 60pmin Choose your girl and connect LIVE Call 09094646899 now Cheap Chat UKs biggest live service VU BCM1896WC1N3XX
541	I am in tirupur da once you started from office call me
5372	Hi mom we might be back later than
3198	I av a new number   Wil u only use this oneta
4818	Anything is valuable in only 2 situations First Before getting it Second After loosing it
2300	Dont pick up d call when something important is There to tell Hrishi
3205	Haha Yup hopefully  we will lose a few kg by mon after hip hop can go orchard and weigh again
1790	Arun can u transfr me d amt
5134	That sucks Ill go over so u can do my hair Youll do it free right
4299	thesmszonecom lets you send free anonymous and masked messagesim sending this message from theredo you see the potential for abuse
1901	I love working from home 
3859	No But we found a diff farm shop to buy some cheese On way back now can i call in
1074	Dear Uve been invited to XCHAT This is our final attempt to contact u Txt CHAT to 86688
4180	Two teams waiting for some players
1870	Today my system sh get readyall is well and i am also in the deep well
931	money you r a lucky winner  2 claim your prize text money 2 88600 over £1million to give away  ppt150x3normal text rate box403 w1t1jy
2214	This is one of the days you have a billion classes right
5171	I‘ve got some salt you can rub it in my open wounds if you like
1233	have got  few things to do may be in  pub later
4447	2 celebrate my bday y else
4451	Urgent UR awarded a complimentary trip to EuroDisinc Trav AcoEntry41 Or £1000 To claim txt DIS to 87121 186£150moreFrmMob ShrAcomOrSglSuplt10 LS1 3AJ
4530	HOW ARE U I HAVE MISSED U I HAVENT BEEN UP 2 MUCH A BIT BORED WITH THE HOLIDAY WANT 2 GO BAK 2 COLLEGE SAD ISNT ITxx
2444	I donno if they are scorable
2736	Can you do a mag meeting this avo at some point
3616	Ok c ü then
1841	Are we doing the norm tomorrow I finish just a 415 cos of st tests Need to sort library stuff out at some point tomo  got letter from today  access til end march so i better get move on
3647	wamma get laidwant real doggin locations sent direct to your mobile join the UKs largest dogging network txt dogs to 69696 nownyt ec2a 3lp £150msg
5522	Can you pls send me that company name In saibaba colany
2594	My friend just got here and says hes upping his order by a few grams hes got    when can you get here
4743	Many more happy returns of the day I wish you happy birthday
2710	Nah Im a perpetual DD
1054	I got another job The one at the hospital doing data analysis or something starts on monday Not sure when my thesis will got finished
3073	Apart from the one i told you about yesterday
5198	Darren was saying dat if u meeting da ge den we dun meet 4 dinner Cos later u leave xy will feel awkward Den u meet him 4 lunch lor
4484	What do u reckon as need 2 arrange transport if u cant do it thanks
1259	Am also doing in cbe only But have to pay
3057	EASTENDERS TV Quiz What FLOWER does DOT compare herself to D VIOLET E TULIP F LILY txt D E or F to 84025 NOW 4 chance 2 WIN £100 Cash WKENT150P16
4055	I was slept that timeyou there
174	What time you coming down later
379	Well theres not a lot of things happening in Lindsay on New years sighs Some bars in Ptbo and the blue heron has something going
190	Have you got Xmas radio times If not i will get it now
3385	K Must book a not huh so going for yoga basic on sunday
4875	Lol Oops sorry Have fun
2183	Ok
3264	O shore are you takin the bus
5361	Hmm Shall i bring a bottle of wine to keep us amused Just joking Ill still bring a bottle Red or white See you tomorrow
4525	Actually I decided I was too hungry so I havent left yet V
141	Got c I lazy to type I forgot ü in lect I saw a pouch but like not v nice
582	Huh so early Then ü having dinner outside izzit
5509	Gods love has no limit Gods grace has no measure Gods power has no boundaries May u have Gods endless blessings always in ur life Gud ni8
233	Dear we are going to our rubber place
4361	Ü only send me the contents page
2529	Mmmmm  I loved waking to your words this morning  I miss you too my Love I hope your day goes well and you are happy I wait for us to be together again
1364	What does the dance river do
1845	Super dagood replacement for murali
4757	U wan 2 haf lunch im in da canteen now
2878	Fuck cedar key and fuck her come over anyway tho
2139	Then why you came to hostel
4443	Im going 2 orchard now laready me reaching soon U reaching
2141	But i juz remembered i gotta bathe my dog today
2856	Haha Hope ü can hear the receipt sound Gd luck
2876	Crucify is c not s You should have told me earlier
1766	Hi 07734396839 IBH Customer Loyalty Offer The NEW NOKIA6600 Mobile from ONLY £10 at TXTAUCTIONTxt wordSTART to No81151  get Yours Now4T
3043	Aight what time you want me to come up
1013	I just got home babe are you still awake 
4215	I attended but nothing is there
2076	Yar lor actually we quite fast Cos da ge slow wat Haha
2774	Still in customer place
5488	Also fuck you and your family for going to rhode island or wherever the fuck and leaving me all alone the week I have a new bong 
1155	1000s of girls many local 2 u who r virgins 2 this  r ready 2 4fil ur every sexual need Can u 4fil theirs text CUTE to 69911£150p m
4781	O we cant see if we can join denis and mina Or does denis want alone time
1775	Im not coming over do whatever you want
3078	Mum hope you are having a great day Hoping this text meets you well and full of life Have a great day Abiola
2178	get ready to moan and scream 
4685	Ok u can take me shopping when u get paid D
2106	Anyway seriously hit me up when youre back because otherwise I have to light up with armand and he always has shit andor is vomiting
3106	Thats y i said its bad dat all e gals know u Wat u doing now
1202	Otherwise had part time job natuition
2284	Whom you waited for yesterday
2127	Sorry im getting up now feel really bad totally rejected that kinda me thing
3691	You still coming tonight
1378	Auntie huai juan never pick up her phone
267	Same Wana plan a trip sometme then
2057	Sir I am waiting for your mail
4031	… anyway many good evenings to u s
4569	But you were together so you should be thinkin about him
709	Quite late lar Ard 12 anyway i wun b drivin
1603	Carlos is taking his sweet time as usual so let me know when you and patty are donewant to smoke and Ill tell him to haul ass
2510	Ok
514	Lol ok your forgiven 
1164	Free entry in 2 a wkly comp to win FA Cup final tkts 21st May 2005 Text FA to 87121 to receive entry questionstd txt rateTCs apply 08452810075over18s
4622	THIS IS A LONG FUCKIN SHOWR
4165	I told that am coming on wednesday
1634	Hello my little party animal I just thought Id buzz you as you were with your friends grins Reminding you were loved and send a naughty adoring kiss
4453	And that is the problem You walk around in julianaland oblivious to what is going on around you I say the same things constantly and they go in one ear and out the other while you go off doing whatever you want to do Its not that you dont know why Im upsetits that you dont listen when i tell you WHAT is going to upset me Then you want to be surprised when Im mad
3572	Customer Loyalty OfferThe NEW Nokia6650 Mobile from ONLY £10 at TXTAUCTION Txt word START to No 81151  get yours Now 4TCtxt TC 150pMTmsg
4331	1AppleDayNo Doctor 1Tulsi LeafDayNo Cancer 1LemonDayNo Fat 1Cup MilkdayNo Bone Problms 3 Litres WatrDayNo Diseases Snd ths 2 Whom U Care
207	Ü say until like dat i dun buy ericsson oso cannot oredi lar
3937	You need to get up Now
5207	How come she can get it Should b quite diff to guess rite
3165	This is the 2nd time we have tried to contact u U have won the £1450 prize to claim just call 09053750005 b4 310303 TCsstop SMS 08718725756 140ppm
2748	K dahow many page you want
2160	I think you should go the honesty road Call the bank tomorrow Its the tough decisions that make us great people
1642	Alright were all set here text the man
1422	No Shes currently in scotland for that
5289	Im still pretty weak today  Bad day 
208	As I entered my cabin my PA said  Happy Bday Boss  I felt special She askd me 4 lunch After lunch she invited me to her apartment We went there
2833	Thanx 4 sending me home
667	En chikku nange bakra msg kalstiyathen had teacoffee
3609	I have no idea where you are
5102	Ah well that confuses things doesnt it I thought was friends with now Maybe i did the wrong thing but i already sort of invited tho he may not come cos of money
2336	Do you like Italian food
2389	Also wheres the piece
3882	Hi juan Im coming home on fri hey Of course i expect a welcome party and lots of presents Ill phone u when i get back Loads of love nicky x x x x x x x x x
1063	I might come to kerala for 2 daysso you can be prepared to take a leave once i finalise dont plan any travel during my visitneed to finish urgent works
957	Sorry i now then c ur msg Yar lor so poor thing But only 4 one night Tmr ull have a brand new room 2 sleep in
1275	network operator The service is free For T  Cs visit 80488biz
657	Tell them the drug dealers getting impatient
3258	Who were those people  Were you in a tour  I thought you were doing that sofa thing you sent me  Your curious sugar
5312	Jolly good By the way  will give u tickets for sat eve 730 Speak before then x
4586	Noooooooo please Last thing I need is stress For once in your life be fair
5097	Hi ShanilRakhesh herethanksi have exchanged the uncut diamond stuffleaving back Excellent service by Dino and Prem
2720	18 days to Euro2004 kickoff U will be kept informed of all the latest news and results daily Unsubscribe send GET EURO STOP to 83222
1001	Aight will do thanks again for comin out
848	My stomach has been thru so much trauma I swear I just cant eat I better lose weight
4537	IM LATE TELLMISS IM ON MY WAY
917	I could ask carlos if we could get more if anybody else can chip in
5027	I was gonna ask you lol but i think its at 7
3344	You will go to walmart Ill stay
451	10 min later k
1961	Howz that persons story
559	I know that my friend already told that
2522	Misplaced your number and was sending texts to your old number Wondering why ive not heard from you this year All the best in your mcat Got this number from my atlanta friends
1848	Its on in engalnd But telly has decided it wont let me watch it and mia and elliot were kissing Damn it
1521	Check wid corect speling ie Sarcasm
2679	Where in abj are you serving Are you staying with dad or alone
3297	Dunno lei ü all decide lor How abt leona Oops i tot ben is going n i msg him
2474	Final Chance Claim ur £150 worth of discount vouchers today Text YES to 85023 now SavaMob member offers mobile T Cs SavaMob POBOX84 M263UZ £300 Subs 16
1572	Noi got rumour that you going to buy apartment in chennai
3158	Long time You remember me today
162	Keep yourself safe for me because I need you and I miss you already and I envy everyone that sees you in real life
44	WHO ARE YOU SEEING
4905	Im reaching in another 2 stops
3713	Sorry pa i dont knw who ru pa
2954	Tell me whos this pls
2704	Omw back to tampa from west palm you hear what happened
2399	Neshanthtel me who r u
4631	Only saturday and sunday holiday so its very difficult
1426	Yes now only saw your message
4756	Ok lor Or u wan me go look 4 u
2066	Pass dis to all ur contacts n see wat u get Redim in luv wid u Blueu put a smile on my face Purpleu r realy hot Pinku r so swt Orangei thnk i lyk u Greeni realy wana go out wid u Yelowi wnt u bck Blackim jealous of u Browni miss you Nw plz giv me one color
172	Sir I need AXIS BANK account no and bank address
5514	It‘s reassuring in this crazy world
3510	Camera quite good 101mega pixels 3optical and 5digital dooms Have a lovely holiday be safe and i hope you hav a good journey Happy new year to you both See you in a couple of weeks
130	HEY GIRL HOW R U HOPE U R WELL ME AN DEL R BAK AGAIN LONG TIME NO C GIVE ME A CALL SUM TIME FROM LUCYxx
2398	Well you told others youd marry them
1764	Sometimes Heart Remembrs someone Very much Forgets someone soon Bcoz Heart will not like everyone But liked ones will be Remembered Everytime BSLVYL
8	As per your request Melle Melle Oru Minnaminunginte Nurungu Vettam has been set as your callertune for all Callers Press 9 to copy your friends Callertune
2040	Hey are we going for the lo lesson or gym
3457	No need lar Jus testing e phone card Dunno network not gd i thk Me waiting 4 my sis 2 finish bathing so i can bathe Dun disturb u liao u cleaning ur room
2938	And stop wondering wow is she ever going to stop tming me  because I will tm you whenever I want because you are MINE  laughs
4145	In The Simpsons Movie released in July 2007 name the band that died at the start of the film AGreen Day BBlue Day CRed Day Send A B or C
4908	Will you come online today night
852	U reach orchard already U wan 2 go buy tickets first
2328	The Xmas story is peace The Xmas msg is love The Xmas miracle is jesus Hav a blessed month ahead amp wish U Merry Xmas
138	He is there You call and meet him
5118	Get 3 Lions England tone reply lionm 4 mono or lionp 4 poly 4 more go 2 wwwringtonescouk the original n best Tones 3GBP network operator rates apply
2265	Not heard from U4 a while Call 4 rude chat private line 01223585334 to cum Wan 2C pics of me gettin shagged then text PIX to 8552 2End send STOP 8552 SAM xxx
4252	How much for an eighth
928	But Im on a diet And I ate 1 too many slices of pizza yesterday Ugh Im ALWAYS on a diet
2520	Joys father is John Then John is the NAME of Joys father Mandan
3909	No that just means you have a fat head
4772	CHEERS LOU YEAH WAS A GOODNITE SHAME U NEVA CAME C YA GAILxx
5121	Are you driving or training
